<?xml version="1.0"?>

<pets
    xmlns="http://www.example.org/pets"
xmlns:xsi="http://www.w3.org/2001/XMLSchema-instance"
xsi:schemaLocation="http://www.example.org/pets pets.xsd">
  <dogs>
    <dog breed="Labrador">
      <color>Black</color>
    </dog>
    <dog breed="Labrador">
      <color>Golden</color>
    </dog>
  </dogs>
  <cats>
    <cat breed='Siamese'>
      <color>Cream</color>
    </cat>
    <cat breed='Burmese'>
      <color>Grey</color>
    </cat>
    <cat breed='Tortoiseshell'>
      <color>Brown</color>
    </cat>
  </cats>
</pets>
